cuenta,password,nombre_apellido,descripcion,departamentos
pepeh,Lcslsn-24,pepe hernandez,jefe del departamento de ventas,DepVentas
juanc,Lcslsn-24,juan carlos,empleado del departamento de ventas,DepVentas
miguelf,Lcslsn-24,miguel fernandez,jefe del departamento de desarollo,DepDesarollo
jonyt,Lcslsn-24,jony taban,empleado del departamento de desarollo,DepDesarollo
isacp,Lcslsn-24,isac patulea,jefe del departamento de dise単o,DepDise単o
carlosh,Lcslsn-24,carlos hernandez,empleado del departamento de dise単o,DepDise単o