cuenta,password,nombre_apellido,descripcion,departamentos
pepeh,15Pr4ba!$caR8S,pepe hernandez,jefe del departamento de ventas,DepVentas
juanc,15Pr4ba!$caR8S,juan carlos,empleado del departamento de ventas,DepVentas
miguelf,15Pr4ba!$caR8S,miguel fernandez,jefe del departamento de desarollo,DepDesarollo
jonyt,15Pr4ba!$caR8S,jony taban,empleado del departamento de desarollo,DepDesarollo
isacp,15Pr4ba!$caR8S,isac patulea,jefe del departamento de dise単o,DepDise単o
carlosh,15Pr4ba!$caR8S,carlos hernandez,empleado del departamento de dise単o,DepDise単o
